type,title,subtitle,date,from,text,topic
Press release,New protections for British food and drink in Japan,"UK secures special protected status as geographical indications for a further 39 British food and drink products in Japan.  ",2024-12-22,"Department for Environment, Food & Rural Affairs","Diners in Japan will be tucking into authentic UK products this festive period after the country granted special protected status to nearly 40 British food and drink products. 

Festive favourites such as Single Malt Welsh Whisky and Beacon Fell Traditional Lancashire Cheese are just some of the products to receive the status, which means British businesses can export to Japan with confidence that their products are protected against imitation. 

The news has been welcomed as an early Christmas present by food and drink businesses across the UK and could see a boost to British exports in Japan.

Japan’s population of 124 million has a strong appetite for international food and drink and the country’s status as the world’s fourth largest economy in 2023 highlights the strength of its consumer market and the commercial opportunities for premium British products. 

39 distinctive products from England, Scotland, Wales and Northern Ireland, already protected and celebrated by the UK Government as geographical indications (GIs), have formally gained protection following the completion of Japanese scrutiny processes. 

These protections will safeguard British food and drink products with a distinct local identity, supporting jobs and tourism in mainly rural areas and boosting local growth, as part of the government’s Plan for Change. 

The latest batch of GIs follows 37 that gained protection in the country earlier this year, including Cornish Pasties and Anglesey Sea Salt. 

Minister for Food Security Daniel Zeichner said:

 I’m thrilled to see there’s a taste for authentic British food and drink in Japan. We are committed to growing trade opportunities for British producers around the world as part of our Plan for Change, boosting growth and benefitting businesses across the country. 

The UK is home to a feast of flavours from every corner of the British Isles. With the new agreement between the UK and Japan, consumers will now be able to chew over their choices with confidence, knowing they’re getting the quality and reputation that British food is known for - it’s the perfect recipe for success.

Trade Minister Douglas Alexander said: 

Iconic UK products such as Ayrshire New Potatoes and Carmarthen Ham will now benefit from protected status in Japan. From Sussex to Armagh we are securing protections for unique British food and drink products, ensuring Japanese consumers can rest assured that they are receiving authentic, high-quality British produce.

This early Christmas present to British producers will give them confidence when exporting to Japan, helping them sell more, grow their business and ultimately drive economic growth.” 

Co-founder of Rathfinny Wine Estate, Mark Driver said:

We launched Rathfinny’s Traditional Method Sussex sparkling wines in Japan in 2023 and are delighted that the Sussex PDO will now be afforded protection in Japan. The Sussex PDO is a mark of both provenance and quality, ensuring any wine with ‘Sussex’ on the label has had to pass a stringent blind tasting and high analytical standards.

Rathfinny’s Traditional Method Sussex sparkling wines are produced on a single-site vineyard, in the iconic South Downs near the Seven Sisters in East Sussex. They are now available across Japan through the specialist wine importer, Vin Passion.

Chief Executive Officer of Penderyn Distillery, Stephen Davies said: 

Japan is an important market for world-class single malt whisky, making it a key target market for Penderyn Single Malt Welsh Whisky. 

We have a great partner (Whisk-E) and together we plan to build awareness and reputation for our unique brand from Wales. The establishment of the geographical indication for Single Malt Welsh Whisky in 2022 was an important milestone in the development of the whisky industry in Wales and to have recognition in Japan will be a great achievement to support our export strategy.

Co-Founder and Managing Director of Halen Môn, Alison Lea-Wilson said: 

We are proud to have the name and method of Halen Môn recognised in Japan as authentic and possessing the special qualities that set it apart from other salts. 

GI status offers brands such as Halen Môn protection against passing off and another way of differentiating ourselves from our competitors. We know that Japanese consumers recognise the premium quality of British brands and are keen to buy the authentic product, so it’s great to hear that Japan is recognising further GIs from the UK.

Further British GIs have been recognised across the world in recent months, with fourteen UK GIs including Welsh Laverbread, Vale of Evesham Asparagus and London Cure Smoked Salmon granted protection in Iceland on 4 December under the Free Trade Agreement between the UK and Iceland, the Principality of Liechtenstein, and the Kingdom of Norway. 

This followed new protections for Scotch Whisky in Brazil, South America’s largest economy, in August, tackling counterfeits and giving distillers the confidence to up their exports to Brazil.

Further information 
Geographical Indications 
A Geographical indication (GI) is an intellectual property right used on products that have qualities or characteristics attributable to a specific geographical origin. Examples include Scotch Whisky, Welsh Lamb and Melton Mowbray Pork Pies. 
Food, drink and agricultural products with a geographical connection or that are made using traditional methods can be registered and protected as intellectual property. 
Geographical indications protect the authenticity of many of our most prestigious food and drink products and give consumers confidence that international GI products are genuine articles. 
The UK’s annual GI exports are estimated to be worth over £6 billion and account for 25% of UK food and drink exports’ value. 
UK food, drink, and agricultural products to be protected in Japan include: 
Armagh Bramley Apples
Ayrshire New Potatoes/Ayrshire Earlies
Beacon Fell Traditional Lancashire Cheese
Bonchester Cheese
Buxton Blue
Cambrian Mountains Lamb
Carmarthen Ham
Cornish Sardines
Darnibole
Dovedale Cheese
Fal Oysters
Fenland Celery
Gloucestershire Cider
Gloucestershire Perry
Gower Salt Marsh Lamb
Lakeland Herdwick
New Season Comber Potatoes / Comber Earlies Potatoes
Newmarket Sausage
Orkney Beef
Orkney Lamb
Rutland Bitter
Scottish Wild Salmon
Shetland Lamb
Sussex Wine
Swaledale Ewes Cheese
Teviotdale Cheese
The Vale of Clwyd Denbigh Plum
Traditional Welsh Cider
Traditional Welsh Perry
Vale of Evesham Asparagus
West Wales Coracle Caught Salmon
West Wales Coracle Caught Sewin
Whitstable Oysters
Worcestershire Cider
Worcestershire Perry
Yorkshire Forced Rhubarb
New Forest Pannage Ham
Welsh Leeks
Welsh Whisky",Food and farming industry
Press release,"10,000 UK Armed Forces personnel deployed overseas to keep us safe this Christmas",The Defence Secretary visited British Army soldiers deployed in Estonia this Christmas to thank them for their service,2024-12-22,Ministry of Defence,"The Defence Secretary visited UK Armed Forces personnel deployed to Estonia to thank them for their vital service at Christmas.

Some 10,000 sailors, marines, soldiers, and aviators will spend Christmas Day deployed overseas, sacrificing celebrations with their families and friends to keep the UK safe.

The work of the UK Armed Forces continues over Christmas on 60 operations in 44 countries this, while hundreds more personnel are working to protect the UK’s skies, shores, and seas at home.

There are 900 British personnel deployed in Estonia, ready to defend NATO’s eastern flank and working alongside French and Estonian forces to deter aggression and uphold stability in eastern Europe.

The visit to Estonia by the Defence Secretary also highlighted the UK’s unwavering dedication to NATO and commitment to defending the alliance.

Defence Secretary, John Healey MP, said: 

In a world in which global insecurities are rising, we depend more and more on those who are willing to serve. And those who are willing to serve are supported by the families that stand with them and behind them.

This Christmas, I pay special tribute to those 10,000 military personnel who are deployed overseas, many of them not seeing family and loved ones at this important time.

It was an honour to spend time with some of those troops in Estonia, to serve them Christmas lunch and thank them for their commitment and professionalism. This week they will sacrifice what most of us take for granted, that special time with our families, to ensure that our nation is safe. 

Our British deployment in Estonia demonstrates our unshakeable commitment to NATO and the security of Europe, keeping us secure at home and strong abroad. Our presence here is a powerful message to our allies and adversaries: the UK stands ready to defend its allies and uphold our shared values, all year round.

The visit to Estonia provided an opportunity for the Defence Secretary to discuss Project ASGARD, which will help UK Armed Forces in the country utilise new and emerging tech to become more lethal and better able to defeat the enemy.

It will harness developing technologies including artificial intelligence (AI), drones, and advanced sensors to help more quickly discover and process information and strike enemies on the battlefield, with priority work continuing on the programme in 2025.

The UK’s relationship with Estonia is a cornerstone of NATO’s defence. British personnel stationed in Estonia form a vital part of the enhanced Forward Presence, ensuring a permanent presence along the alliance’s eastern flank.

The visit comes as the UK has recently signed a defence roadmap with Estonia. The agreement will see the UK’s 4th Brigade Combat Team held at high readiness from 2025, ready to deploy at short notice to Estonia in times of crisis.

It will also include the first overseas deployment of the UK’s cutting-edge Challenger 3 tanks and Boxer armoured vehicles, reinforcing NATO’s defensive capabilities along its eastern border.

The British deployment at Tapa remains the UK’s largest permanent overseas deployment, and both countries are working together closer than ever, with the UK leading on the new DIAMOND initiative, which will improve NATO’s integrated air and missile defence by ensuring that the different air defence systems across the Alliance operate better and more jointly across Europe.

Paying tribute to Armed Forces personnel on duty at Christmas, the Chief of the Defence Staff, Admiral Sir Tony Radakin said:

Thank you to all our Armed Forces personnel for your extraordinary hard work this year.

From delivering the nuclear deterrent and policing NATO skies, to training Ukrainian recruits and protecting merchant shipping in the Red Sea, the Armed Forces have stepped up to deliver all that the nation asks of us.

I am immensely grateful to those deployed away from home over the festive season and wish you all a Merry Christmas and a Happy New Year.

In the UK, Royal Air Force aviators at RAF Boulmer and NATS Swanwick are ready to scramble Typhoon aircraft from RAF Coningsby and RAF Lossiemouth to monitor any hostile aircraft which approach UK airspace.

Behind the scenes and out of sight at the MOD’s digital HQ in Corsham, military cyber experts will remain vigilant this festive season, defending the UK against constant cyber threats every minute of every day.

These dedicated professionals ensure the security of vital digital networks, guaranteeing that the systems that connect our people, places, and equipment run smoothly and securely.

Royal Navy ships will also continue their work protecting the UK’s seas and coastline.

Somewhere, deep in the ocean, a Royal Navy nuclear attack submarine continues to provide the nation’s nuclear deterrent in a patrol that has continued 24 hours a day, 365 days a year, for 55 years.

And the Household Division of the British Army will continue to guard royal palaces in the nation’s capital throughout the Christmas period.

In an address to the soldiers deployed at Tapa Army Base in Estonia, the Defence Secretary said:

I wanted to say, above all, thank you. Thank you on behalf of all those back home who will never have the chance to say this to you for themselves. Thank you for your commitment to keeping our country safe.

This is a really important deployment for us. What you’re doing here really matters. It matters for the security of Europe, and it matters to us all back home in Britain.

You are making good on Britain’s unshakable commitment to NATO and to a safe and peaceful Europe. And that’s why we have this Operation CABRIT, the biggest commitment of British troops in another country.

Here on the front line, we must also be on the cutting edge of new technologies and new combat techniques we must learn from Ukraine.

We ask a lot of you all in the Armed Forces, not least the separation from your families and your friends and your loved ones. And at Christmas, that sense of separation can be especially strong.

So thank you for your service. Thank you for your willingness to sacrifice what almost all of the rest of us take for granted. It’s an honour to be with you.",Armed forces
News story,The Lockerbie bombing,"Scottish Secretary Ian Murray has spoken about the Lockerbie bombing, on the 36th anniversary of the atrocity [21 December 2024]",2024-12-21,Scotland Office,"Mr Murray said:

Thirty six years on from the terrible tragedy of the Lockerbie bombing, it is right that we take time to remember those who lost their lives, and indeed all those affected by what happened that night. Our thoughts are with the families and friends of the 270 who perished in the air and on the ground, and all those in the town who saw such devastation rain down on them.

I know that there are strong and enduring links between the Lockerbie community and Syracuse University, and it is heartening to know that something positive has come out of such unimaginable horror.",Health and social care
