type,title,subtitle,date,from,text,topic
Press release,Eight-year ban for former footballer who ran London sports academy,"Kieron Minto-St.Aimie received a director’s disqualification for claiming a £25,000 Covid loan his company was not entitled to.",2024-12-23,The Insolvency Service,"Kieron Minto-St.Aimie is a former professional footballer who went on to run a sports academy in Brent. 
His company received the £25,000 Covid Bounce Back Loan after he overstated its turnover. 
He was disqualified as a company director for eight years at London’s Royal Courts of Justice. 

A former professional footballer has been banned from being a company director for eight years. 

Kieron Minto-St.Aimie claimed a £25,000 Covid Bounce Back Loan for the St Aimie’s Sports Academy Community Interest Company in Brent, when it was entitled to much less. 

Elizabeth Pigney, Chief Investigator at the Insolvency Service, said: “Kieron Minto-St.Aimie successfully applied for a Covid Bounce Back loan by overstating his company’s turnover. 

His eight-year disqualification should serve as a warning to others that the justice system will not allow business owners to make false declarations to obtain funds that were so crucially needed by other small and medium-sized businesses during the pandemic.

The former footballer, aged 35, of Pound Lane in London, began his career at Queens Park Rangers before spells at clubs including Oxford United and Barnet. 

He opened St.Aimie’s Sports Academy, on Harlesden Road in Brent, as its sole director in 2016. 

Before its closure in January 2023, the academy was known in the local community for providing football coaching and mentoring to children and young people. 

In May 2020, Minto-St.Aimie applied for a Covid Bounce Back loan of £25,000. 

However, in order to obtain the £25,000 he overstated the company’s turnover by £60,000 as it should have only been entitled to around £10,000 under the scheme based on its actual turnover. 

On 6 December 2024, the judge at London’s Royal Courts of Justice disqualified Minto-St.Aimie as a company director for eight years.

Further information 
Kieron Minto-St.Aimie is of Pound Lane, London. His date of birth is 4 May, 1989. 
St.Aimie’s Sports Academy (company number 10534175) 
Read more about the Bounce Back Loan Schene and the action the Insolvency Service can take of it finds misconduct. 
Further information about the work of the Insolvency Service, and how to complain about financial misconduct. ",Business and industry
Press release,Serious Fraud Office launches 2025 Trainee Investigator Programme,The Serious Fraud Office (SFO) has opened applications for its 2025 Trainee Investigators Programme.,2024-12-23,Serious Fraud Office,"Launched in 2018, the programme has run successfully for over six years, equipping trainees with the core skills necessary for a career investigating major crime.

Trainees receive hands-on investigation training and gain valuable, first-hand experience working alongside the SFO’s operational teams to tackle the largest and most complex economic crime cases in the UK. Successful applicants will work with and be offered guidance from some of the country’s most experienced investigators and lawyers.

The programme is open to anyone with an interest in the law, with applications accepted from 20 December 2024 to 12 January 2025. Since its creation, the scheme has welcomed over 100 trainees from all walks of life, including university graduates, career changers and individuals with a long-held interest in the law and criminal justice.

Serious Fraud Office Chief Investigator Mick Gallagher said: “Our Trainee Investigator Programme offers applicants the chance to work on the largest and most high-profile economic crime cases here in the UK.

“It allows people from all walks of life the opportunity to immerse themselves in fraud investigation training, equipping them with the core operational skills needed as they’re guided through the stages of an investigation.

“The feedback we receive from those who have completed the Programme in previous years has been overwhelmingly positive and we’re very proud of our training investigators.”

Applicants will be notified this Spring if they have been successful applying to the Programme. Graduates who successfully complete the 15-month Programme will be promoted to the role of Investigator.","Crime, justice and law"
News story,DBS Christmas and New Year Opening Times 2024,DBS' Contact Centre will operate under reduced hours over the Christmas and New Year period.,2024-12-23,Disclosure and Barring Service,"Our Contact Centre will be operating under reduced hours over the Christmas and New Year period. Core DBS services and turnaround times for DBS checks and barring decisions will not be affected, and employers and customers should continue to access our services as normal.  

Online services such as the Update Service and online tracking  will also available as usual over Christmas.

Date Opening hours 23rd December 9am to 5pm 24th December 9am to 3pm Christmas Day Closed Boxing Day Closed 27th December 9am to 5pm 30th December 9am to 5pm 31st December 9am to 3pm New Year’s Day Closed 2nd January 9am to 5pm 3rd January 9am to 5pm",NA
World news story,Call for in-kind sponsorship for a Cyber Event in Tokyo,"The British Embassy Tokyo is looking for in-kind sponsorship to help deliver a Cyber Event in February. ",2024-12-23,British Embassy Tokyo,"The British Embassy Tokyo is looking for in-kind sponsorship to help deliver a Cyber Event in February.

The Cyber Event will be held on 26 February. Any company wishing to register an expression of interest for sponsorship should make contact with the Embassy as below by 17:00 JST on Wednesday 8 January 2025.

In-kind sponsorship: Chris.Capper@fco.gov.uk",Corporate information
Press release,British soldiers successfully test drone killer radiowave weapon for first time,British soldiers have successful trialled for the first time a game-changing weapon that can take down a swarm of drones using radio waves for less than the cost of a pack of mince pies.,2024-12-23,Ministry of Defence,"Radio Frequency Directed Energy Weapons (RFDEW) can take down a swarm of drones for less than the cost of a pack of mince pies. 

Systems are capable of hitting targets up to 1km away and costs just 10p per shot 

The programme supports more than 135 highly-skilled jobs across UK industry 

British soldiers have successfully trialled for the first time a game-changing weapon that can take down a swarm of drones using radio waves for less than the cost of a pack of mince pies. 

The Radio Frequency Directed Energy Weapon (RFDEW) development system can detect, track and engage a range of threats across land, air and sea. 

RFDEWs are capable of neutralising targets up to 1km away with near instant effect and at an estimated cost of 10p per shot fired, providing a cost-effective complement to traditional missile-base air defence systems. 

The RFDEW is different from Laser Directed Energy Weapons – such as DragonFire - because it uses a radio frequency to disrupt hostile threats, rather than a laser beam of light energy. 

The weapon uses high frequency waves to disrupt or damage critical electronic components inside devices such as drones, causing them to be immobilised or fall out of the sky. It can also be used against threats on land and at sea. 

The British Army successfully trialed a demonstrator version of the RFDEW. The development system has been produced by a consortium led by Thales UK and including sub-contractors QinetiQ, Teledyne e2v and Horiba Mira and supports up to 135 high-skilled jobs in the UK. 

This progress helps deliver on the Government’s Plan for Change by rapidly advancing technologies and building on the strong foundation of national security. 

Its high level of automation means the system can be operated by a single person and could be mounted onto a military vehicle, such as a MAN SV, to provide mobility. 

Minister for Defence Procurement and Industry, Maria Eagle MP, said: 

The successful firing by the British soldiers of our Radio Frequency Directed Energy Weapon is another step forward for a potentially game-changing sovereign weapon for the UK. 

It’s great to see defence experts and industry working collaboratively to put cutting-edge equipment in the hands of our Armed Forces. 

This is demonstration of the UK remaining at the forefront of directed energy weapons and developing a crucial advantage against the emerging threats we face.

A live firing trial was recently completed by the Army’s Royal Artillery Trials and Development Unit and 7 Air Defence Group at a range in West Wales, where they successfully targeted and engaged Uncrewed Aerial Systems (UAS), in a first for the British Armed Forces. 

The user experimentation trials completed in recent months have enabled Army air defence personnel to explore and exercise the capability’s potential in different configurations across a variety of range environments, threat types and engagement scenarios. 

This activity follows the development process announced back in May and delivered by Team HERSA - a joint enterprise between UK MOD’s Defence Equipment & Support and Defence Science and Technology Laboratory (Dstl). 

Dstl Programme Lead, Matt Cork said: 

Getting this technology into the hands of our service personnel is hugely rewarding. 

Dstl has worked collaboratively with DE&S and industry which has meant the rapid evolution of radio frequency technology. 

Nigel MacVean, Managing Director, Thales IAS, said: 

I am thrilled with the successful RFDEW firing trials. Thales has been at the forefront of this pioneering technology for over 40 years and our continued research and development in this sector, along with our partners in Government, paves the way for a strong future in this field.

This latest trial marks a pivotal moment in the UK’s ongoing efforts to enhance the future operational capabilities of the Armed Forces and offers a precise, powerful, and cost-effective means to defeat multiple aerial threats. 

The trials programme will continue to enable further development and experimentation, while Team HERSA continues to work with operators to develop RFDEW requirements, doctrine and technology, shaping the next generation of mission-optimised RFDEWs. ","Military equipment, logistics and technology"
Press release,Local treasures in Wales to be saved and restored,"Over £2 million will be awarded to seven local treasures in Wales including community centres, music venues and leisure centres.",2024-12-23,"Ministry of Housing, Communities and Local Government","Seven local treasures in Wales including community centres, music venues and leisure centres will be saved and restored thanks to prioritised funding from the UK Government 
UK Government funding will protect local amenities that keep communities thriving, helping fix the foundations of our communities as part of the Plan for Change 
This will help kickstart economic growth and rebuild Britain in a decade of renewal

Over £2 million will be awarded to 7 much-loved local places in Wales, so they can stay open to keep their communities thriving. 

This includes £1 million to save 4 spaces in Wales, including the Tafarn y Plu pub in Gwynedd, The Bunkhouse music venue in Swansea, a museum in Powys and a community shop in Gwynedd. This funding will be used to refurbish, renovate and secure the future of each of these buildings, allowing them to offer a diverse programme of events and activities including live music, well-being sessions and educational opportunities. 

As set out in its Plan for Change, the UK government is committed to kickstarting economic growth and raising living standards. Thriving communities lie at the heart of a thriving economy, and the support provided by the Community Ownership Fund will inject funding where it is most needed, making change happen and bringing people together in the process. 

The highest single award in Wales - £400 thousand - will also go to saving Llanfair Light Railway station and Cloverlands car model museum. This project will host a museum, archives, and a shared community space for residents and visitors to use. The funding will allow the community building to provide a visitor centre in which tours will learn the context to the railway station and its operations. 

Minister for Local Growth, Alex Norris said: 

“These are all multi-functional spaces that do so much for local people and most of us will have fond memories in treasured places like these. 

“We’ve prioritised these grants to help preserve and upgrade what these vital places offer to their communities – whether improving access to sport, tackling loneliness or boosting family services for parents and children.” 

Projects also set to receive money in Wales include: 

£300,000 to renovate Eveswell Community Centre in Newport. The centre will provide new and improved facilities for local families to host more activities like family groups, play groups, a Lego club, craft classes and after school youth groups. 

£300,000 to refurbish the Pentre Comrades club. The transformed building will provide the community a central hub to use for socialising and learning with facilities including a pub, shop, café, community garden, and kitchen spaces. 

£299,000 to renovate and refurbish Caerphilly Rugby Football Club. The space will provide new and improved facilities for their rugby development programmes as well as space to host events like fundraisers, local festivals and educational workshops. 

Welsh Secretary, Jo Stevens said:

“Congratulations to these fantastic community projects in Wales. Over £2 million is being spent by the UK Government to make sure that these special places are refurbished and improved so they can provide facilities for local people to come together. 

“All across Wales there are brilliant people who give back to their communities. I’d like to thank them for all that they do and the UK Government is proud to be able to support them.” 

This UK-wide funding prioritised by the Ministry of Housing, Communities and Local Government will help protect these cherished places from closure and disrepair, preserving popular spots for local people and visitors. 

Altogether £36 million has been awarded to 85 projects across the UK. 

The projects will support the government on its path to national renewal through its missions in the Plan for Change - from breaking down barriers to opportunity to kickstarting economic growth and creating safer streets by restoring community pride.",Community and society
Press release,Eighty-five local treasures to be saved and restored,"An additional £36 million of funding to rescue and restore 85 local treasures including community centres, pubs, parks and sport centres.",2024-12-23,"Ministry of Housing, Communities and Local Government","Government funding will save at least 35 community centres, helping fix the foundations of our communities as part of the Plan for Change
Money will boost opportunities and help grow local economies, supporting the government’s drive for national renewal
This will help kickstart economic growth and rebuild Britain in a decade of renewal

Cherished community centres are among the 85 local venues across the UK that are set to receive government support to stay open, helping to fix the foundations of our communities.

An additional £36 million of funding has been provided to back local communities, including the rescue of at least 35 community centres, protecting vital local services, boosting opportunities for working families and supporting local economies.

As set out in its Plan for Change, the government is committed to kickstarting economic growth and raising living standards. Thriving communities lie at the heart of a thriving economy, and the support provided by the Community Ownership Fund will inject funding where it is most needed, making change happen and bringing people together in the process.

The projects will support the government on its path to national renewal, helping realise our regions’ huge potential while creating safer and happier streets by restoring community pride.

Deputy Prime Minister, Angela Rayner said:

“We are delivering on our Plan for Change by saving these vital community assets to provide important opportunities for working people and their families.

“These projects represent what is so special about communities across the UK – bringing people of all ages together, providing vital support and giving them a sense of purpose and belonging.

“Every project will support social causes in the community, keeping widely used services open and thriving to improve people’s health and wellbeing.”

Minister for Local Growth, Alex Norris said:

“These are all multi-functional spaces that do so much for local people and most of us will have fond memories in treasured places like these.

“We’ve prioritised these grants to help preserve and upgrade what these vital places offer to their communities – whether that’s improving access to sport and education, tackling loneliness or boosting family services for parents and children.

“This is just the start of our work to support communities and give them greater control of their assets and we’ll be setting out our full strategy next year.”

Action4Youth, a youth charity in the South East, has been given £300,000 to refurbish the George Amey Centre in Milton Keynes, securing its future as a centre for outdoor education and supporting the charity’s work to tackle knife and gang crime.

Chief Executive of Action4Youth, Jenifer Cameron said:

“We are so grateful to have funding which will enable us to complete our renovation project and to ensure the future of the outdoor centre which benefits 15,000 children and young people each year.

“We can now look forward with optimism and hope to support many more young people in future.”

Nineteen sports clubs and leisure facilities across the country will be saved, including four historic swimming pools. These include the 1960s Portishead Lido in North Somerset - where funding will also be used to renovate the café, supporting the local economy - and one of the last tidal pools left in the country, the Victorian Shoalstone Pool in Devon.

On the Isle of Wight, the Isorropia Foundation will receive more than £1m to purchase and renovate the Medina Valley Centre so it can provide a range of community services including mental health support, training and educational opportunities. And Elmfield Hall in Accrington will be renovated to secure its future as a location for counselling, mentoring and employment courses.

The MacMillan Hub in Edinburgh will be backed with £1.7m so it can continue to promote culture, learning and training opportunities, work and well-being in and around the town centre, and expand its café. And more than £1m will be used to restore the Higher Woodhill Viaduct so the East Lancashire Railway can continue to deliver a heritage railway experience, boosting the local tourism industry in the process.

To tackle loneliness and support rural communities, £3.8 million will go to eight parks and eight pubs, including £300,000 to help buy back a popular village pub in North Yorkshire - The Punch Bowl Inn. £300,000 will also be used to renovate a 200-year-old countryside pub in Gwyned, Wales - Tafarn y Plu. This funding will back local businesses, create jobs and drive growth while restoring community pride.

The government is also developing proposals for delivering on its manifesto commitment to introduce a stronger ‘Right to Buy’ and take over important community assets so they can determine their future in a meaningful way. This will be a genuine shift so local people feel far more control, power and agency in the places they live.

Further information

In Scotland, £5 million will be awarded to 11 projects including over £1.7 million to refurbish and expand a community arts centre in Edinburgh - the MacMillan Hub.

In Northern Ireland, £3.7 million will be awarded to 10 projects including £800,000 to expand the building and outdoor spaces of an autism and additional needs charity in Belfast - Sólás. This will help host more after-school clubs and youth programmes.

In Wales, £2.1 million will be awarded to 7 projects including £400,000 to create a museum for the Welshpool & Llanfair Light Railway, built in 1903 to link farming communities to the town.

In England, almost £25.5 million will be awarded to 57 projects including:

11 projects in the South West worth £4.7 million
8 projects in the North West worth almost £4.6 million
10 projects in the East Midlands worth almost £3.9 million
4 projects in London worth almost £3.2 million
8 projects in the South East worth almost £3 million
6 projects in Yorkshire and the Humber worth almost £2.2 million
5 projects in the West Midlands worth over £1.6 million
3 projects in the East of England worth over £1.7 million
2 projects in the North East worth over £675,256

These projects were applicants to the now closed Community Ownership Fund.

The government has also implemented new High Street Rental Auction regulations, providing local communities and businesses with a right to rent premises that have long sat vacant, casting a cloud over the local area. The power will help to provide new shops and community spaces, supporting businesses and communities to access the high street and create vibrant, bustling spaces they can be proud of. 

The government will also support high streets by strengthening Business Improvement Districts which have helped to improve town and city centres across the United Kingdom for 20 years, while ensuring they operate to high standards and are accountable to their communities. 

The English Devolution White Paper published on 16 December set out ambitious plans which demonstrate this commitment to communities and we will announce more details in 2025, including on the community ownership of assets.",Community and society
